participant_id,source_file,consultation_number,user_message_time_ms,assistant_response_time_ms,consultation_end_time_ms,relative_task_position,user_message_text,assistant_response_text,words_written_in_pre_window,words_written_in_post_window,words_deleted_in_pre_window,words_deleted_in_post_window,words_edited_in_pre_window,words_edited_in_post_window,net_word_change_in_pre_window,net_word_change_in_post_window,text_added_in_pre_window,text_deleted_in_pre_window,text_edited_from_in_pre_window,text_edited_to_in_pre_window,text_added_in_post_window,text_deleted_in_post_window,text_edited_from_in_post_window,text_edited_to_in_post_window,pre_window_ms,post_window_ms
AVLA3MS0U,AVLA3MS0U.txt,1,19392,19392,19392,0.1053,can u write more,"Of course! Here's a continuation of your thoughts on your love for books:

---

I love reading books because they transport me to different worlds, offering an escape from reality and a chance to experience life through different perspectives. Each book is like a new adventure, introducing me to characters who often feel as real as friends and family. The smell of the pages, whether fresh off the press or aged with time, adds to the sensory experience of getting lost in a good story.

Books have the power to evoke a range of emotions, from laughter to tears, and everything in between. They challenge my thinking, broaden my horizons, and deepen my understanding of the world around me. Whether it's fiction or non-fiction, each book leaves a lasting impact, enriching my knowledge and empathy.

There's a special kind of magic in turning a page and not knowing what to expect next. The anticipation of plot twists and the satisfaction of a well-crafted story are unparalleled. I cherish the quiet moments spent with a book, where time seems to stand still and the outside world fades away.

In a world that's constantly buzzing, books offer solace and a sense of calm. They are companions during solitary moments and a source of inspiration and insight. My love for books is an endless journey of discovery, one that I hope will continue to evolve with each story I embrace.",14,0,0,0,0,12,14,11,"okay now i want to write my love for books. I love reading books,...",,,,,,"books,...","books, because they travel me into different worlds. They offer an es",30000,30000
AVLA3MS0U,AVLA3MS0U.txt,2,105175,105175,105175,0.5713,okay can u make just 3 suggestions,"Certainly! Here are three suggestions to enhance your piece about your love for books:

1. **Personal Anecdotes:**
   Include a personal story or anecdote about a specific book that had a significant impact on you. Describe a moment when a book changed your perspective or provided comfort during a challenging time.

2. **Sensory Details:**
   Add more sensory details to bring your love for books to life. Mention the feel of the book in your hands, the sound of pages turning, or the unique smell of an old library or a freshly printed book.

3. **The Power of Imagination:**
   Explore how books fuel your imagination. Discuss how getting lost in a story often inspires you creatively, encouraging you to see the world differently or motivating you to create your own stories and ideas.

These additions could help deepen your expression and make your piece more vivid and relatable.",18,14,0,0,0,0,18,14,"book has souls, I never got to meet, but they still feel as real as friends and family.",,,,"The sound of pages turning, is like the sound of a train moving, it",,,,30000,30000
AVLA3MS0U,AVLA3MS0U.txt,3,156664,156664,156664,0.851,thank you!,"You're welcome! If you have any more questions or need further assistance, feel free to ask. Happy writing! 📚✨",15,1,0,0,0,0,15,1,"pages turning, is like the sound of a train moving, my soul is traveling again.",,,,OK.,,,,30000,30000
OCBP90JA,OCBP90JA.txt,1,19491,19491,19491,0.0862,"hey, we are supposed to write together about spring","Of course! Spring is such a vibrant and refreshing season. Here are a few ideas we can explore together:

1. **Nature's Awakening**: Spring is often seen as a time when nature comes back to life. Trees begin to bud, flowers bloom, and animals emerge from hibernation. We could write about the transformation of landscapes or the beauty of a blossoming garden.

2. **Spring Holidays and Traditions**: Many cultures celebrate spring with unique festivals and holidays. We could explore themes like renewal, new beginnings, or cultural traditions such as Easter, Holi, or Hanami in Japan.

3. **Weather Changes**: Spring often brings unpredictable weather, with both sunny days and spring showers. We could write about how these changes affect people's daily lives, or reflect on the metaphorical significance of rain and sunshine.

4. **Spring Activities**: This season is perfect for outdoor activities like hiking, picnicking, or gardening. We could delve into personal experiences or the joys of spending time outside after a long winter.

5. **Poetry and Prose**: Spring has inspired countless poets and writers. We might want to create our own spring-themed poetry or a short story capturing the essence of the season.

Let me know which direction you'd like to take, or if there's another aspect of spring you find interesting!",,,,,,,,,,,,,,,,,30000,30000
OCBP90JA,OCBP90JA.txt,2,44490,44490,44490,0.1967,"poetry, but i don't want u to write alone ok?","Of course! Let's create a poem together. We can take turns adding lines or stanzas. I'll start with a few lines, and then you can continue from there. Here we go:

---

In the hush of dawn, spring whispers anew,  
Blossoms unfurl in a dance with the dew.  

---

Your turn! Add a line or two, and we can keep building from there.",,,,,,,,,,,,,,,,,30000,30000
OCBP90JA,OCBP90JA.txt,3,81930,81930,81930,0.3622,"I have a lover who, Will turn rain into a rose for you","That's beautiful! Let's keep going:

---

In the hush of dawn, spring whispers anew,  
Blossoms unfurl in a dance with the dew.  
I have a lover who, will turn rain into a rose for you,  
Beneath soft skies where dreams break through.

---

Feel free to add more!",,,,,,,,,,,,,,,,,30000,30000
OCBP90JA,OCBP90JA.txt,4,108290,108290,108290,0.4787,"my heart is red, my soul is well fed","Great addition! Here's what we have so far:

---

In the hush of dawn, spring whispers anew,  
Blossoms unfurl in a dance with the dew.  
I have a lover who, will turn rain into a rose for you,  
Beneath soft skies where dreams break through.  
My heart is red, my soul is well fed,  

---

Your turn!",,,,,,,,,,,,,,,,,30000,30000
OCBP90JA,OCBP90JA.txt,5,119872,119872,119872,0.5299,hey ur turn i wrote this,"Of course, thanks for your patience! Here’s the next part:

---

In the hush of dawn, spring whispers anew,  
Blossoms unfurl in a dance with the dew.  
I have a lover who, will turn rain into a rose for you,  
Beneath soft skies where dreams break through.  
My heart is red, my soul is well fed,  
With whispers of warmth where the cold once tread.  

---

Back to you!",,,,,,,,,,,,,,,,,30000,30000
OCBP90JA,OCBP90JA.txt,6,154017,154017,154017,0.6809,"my ink runs down my cheek, my papers have too much to speak","This is coming together nicely! Here's the updated poem:

---

In the hush of dawn, spring whispers anew,  
Blossoms unfurl in a dance with the dew.  
I have a lover who, will turn rain into a rose for you,  
Beneath soft skies where dreams break through.  
My heart is red, my soul is well fed,  
With whispers of warmth where the cold once tread.  
My ink runs down my cheek,  
My papers have too much to speak.

---

Your turn!",,,,,,,,,,,,,,,,,30000,30000
OCBP90JA,OCBP90JA.txt,7,163290,163290,163290,0.7219,i think its good no?,"Absolutely, it’s a lovely poem! We've captured the essence of spring and the emotions it stirs. If you’re happy with it, then it’s perfect. Let me know if there’s anything else you’d like to write about or work on together!",,,,,,,,,,,,,,,,,30000,30000
OCBP90JA,OCBP90JA.txt,8,180835,180835,180835,0.7994,"i need to wirte more, so add?","Sure thing! Let me add a few more lines to continue the poem:

---

In the hush of dawn, spring whispers anew,  
Blossoms unfurl in a dance with the dew.  
I have a lover who, will turn rain into a rose for you,  
Beneath soft skies where dreams break through.  
My heart is red, my soul is well fed,  
With whispers of warmth where the cold once tread.  
My ink runs down my cheek,  
My papers have too much to speak.  

As petals drift on a gentle breeze,  
Time slows down among the trees.  
Sunlight weaves through branches' lace,  
Casting hope with a golden embrace.  

---

Feel free to add on or let me know if you’d like to steer the poem in a different direction!",,,,,,,,,,,,,,,,,30000,30000
OCBP90JA,OCBP90JA.txt,9,190377,190377,190377,0.8416,nooo not that much,"Got it, let's keep it shorter! I'll add just one more line for you to build on:

---

In the hush of dawn, spring whispers anew,  
Blossoms unfurl in a dance with the dew.  
I have a lover who, will turn rain into a rose for you,  
Beneath soft skies where dreams break through.  
My heart is red, my soul is well fed,  
With whispers of warmth where the cold once tread.  
My ink runs down my cheek,  
My papers have too much to speak.

In the bloom's embrace, silence turns sweet,

---

Your turn! Feel free to adjust or continue from here.",,,,,,,,,,,,,,,,,30000,30000
OCBP90JA,OCBP90JA.txt,10,222076,222076,222076,0.9817,"a lemon tree, makes me feel free","Lovely imagery! Here's the updated poem:

---

In the hush of dawn, spring whispers anew,  
Blossoms unfurl in a dance with the dew.  
I have a lover who, will turn rain into a rose for you,  
Beneath soft skies where dreams break through.  
My heart is red, my soul is well fed,  
With whispers of warmth where the cold once tread.  
My ink runs down my cheek,  
My papers have too much to speak.  

In the bloom's embrace, silence turns sweet,  
A lemon tree, makes me feel free.

---

Feel free to keep it going or let me know if you'd like to add a different touch!",,,,,,,,,,,,,,,,,30000,30000
PI3HHQXB,PI3HHQXB.txt,1,29357,29357,29357,0.1165,"hi, can you give me one idea only on what to write about?","Sure! How about exploring the theme of ""Resilience in Uncertain Times""? You could delve into personal stories, historical events, or strategies for maintaining resilience during challenging periods.",5,15,0,0,0,0,6,15,"Hi, I'm writing here first!",,,,The LLM assistant suggested writing about resilience in uncertain times! I tried to submit but,,,,30000,30000
PI3HHQXB,PI3HHQXB.txt,2,125355,125355,125355,0.4974,thank you!,"You're welcome! If you need any more help or additional ideas, feel free to ask. Happy writing!",21,6,0,0,0,0,21,7,"error message again when I tried to submit, seems that I need to wait more. Let me chat with the LLM",,,,"assistant. Nevermind, I don't wanna use",,,,30000,30000
PINHWMKB,PINHWMKB.txt,1,25507,25507,25507,0.1362,okay can u help me write about the weather,"Of course! Here's a sample paragraph about the weather:

---

The weather is an ever-changing facet of our environment, influencing our daily lives in countless ways. As the seasons transition, the temperature, precipitation, and winds evolve, creating a dynamic atmosphere around us. In the spring, blossoms emerge after months of dormancy, as gentle rains nourish the ground. Summer brings warmth and longer days, inviting people to enjoy outdoor activities and bask in the sunshine. Autumn is characterized by crisp air and the vibrant hues of falling leaves, creating a picturesque landscape. Winter often blankets the earth in snow, offering a serene and tranquil beauty, although it can bring challenges in the form of icy roads and frigid temperatures. Weather patterns can also vary greatly by region, with some areas experiencing tropical storms, others welcoming mild and temperate conditions, and some enduring arid desert climates. Understanding the weather not only helps us prepare for our day-to-day activities but also underscores the interconnectedness of Earth's natural systems.

---

Feel free to tweak or expand on this, depending on your specific focus or the type of writing you're aiming for!",9,12,0,0,0,0,9,13,"hi, im now writing about the weather i guess.",,,,"I'm not sure what to write yet, the LLM gave a long",,,,30000,30000
PINHWMKB,PINHWMKB.txt,2,141418,141418,141418,0.7551,thank you!,"You're welcome! If you need any more help or have any other questions, feel free to ask. Happy writing!",14,0,0,0,0,0,14,0,"winter, I love the snow, it literally feels like a big blanket on earth.",,,,,,,,30000,30000
TLU6DW5O,TLU6DW5O.txt,1,55433,55433,55433,0.2691,"oh hi, I want to write about my love for nature, can u make 2 suggestions so i can write","Of course! Here are two suggestions to help you express your love for nature:

1. **Focus on Personal Experiences:**
   - Begin with a vivid description of a memorable experience you had in nature. This could be a hike through a lush forest, a peaceful day by the ocean, or a camping trip under a starry sky.
   - Describe the sights, sounds, and feelings that made this moment special for you. Reflect on how being in nature made you feel and how it has influenced your life and well-being.

2. **Explore Nature’s Healing Power:**
   - Discuss the therapeutic aspects of nature and how spending time outdoors has helped you relax, recharge, and find clarity.
   - Share specific examples of how nature has served as a refuge during stressful times or how it has inspired creativity, gratitude, and a sense of connection to the world around you.

These suggestions can serve as starting points to deeply convey your appreciation for the natural world.",0,17,0,0,0,0,0,17,,,,,"I remember myself as a kid running between the trees, a peaceful day in the forest with",,,,30000,30000
TLU6DW5O,TLU6DW5O.txt,2,154673,154673,154673,0.751,"thank you, what would u add","You're welcome! Here are a few additional ideas you might add to deepen your piece:

1. **Connection to Seasons:**
   - Talk about how different seasons bring unique beauty and experiences. Maybe you love the vibrant colors of autumn leaves, the renewal of spring blooms, the serenity of a winter landscape, or the energy of a summer day.

2. **Nature's Lessons:**
   - Reflect on the life lessons you've learned from observing nature. This could include the patience of growing plants, the resilience of wildlife, or the cycles of change and renewal in ecosystems.

3. **Environmental Stewardship:**
   - Express any actions you take to protect and preserve nature. This could range from simple habits like recycling or participating in community clean-ups, to advocating for environmental policies or educating others about the importance of conservation.

4. **Cultural or Historical Significance:**
   - If applicable, delve into how different natural places hold cultural or historical value for you or your community. This might involve storytelling, traditions, or any personal meaning tied to these places.

5. **Interconnection with Technology:**
   - Consider discussing how you balance technology with nature. For instance, using tech to enhance your experience outdoors through photography, nature apps for learning, or simply knowing when to disconnect to fully immerse yourself in your surroundings.

These elements can enrich your narrative and help readers connect with your love for nature on a deeper level.",20,0,0,0,0,0,20,0,"weird, nature is really healing, I love spending time there, with music on, just to think and reflect about life.",,,,,,,,30000,30000
TLU6DW5O,TLU6DW5O.txt,3,168590,168590,168590,0.8185,can u add a sentence to my writing,"Certainly! Here's your original piece with an added sentence:

Hey, I want to write today about my love for nature. I remember myself as a kid running between the trees, a peaceful day in the forest with the family. We never camped; I thought I was afraid of bugs, but it turns out, I was actually afraid of sleeping in a tent, really. It's weird, nature is really healing, and I love spending time there with music on, just to think and reflect about life. The rustling leaves and the gentle breeze always remind me of the simplicity and beauty that life has to offer, bringing a sense of calm and perspective that I carry with me long after I leave. 

Feel free to adjust or expand on this to better fit your voice and style!",8,8,0,0,0,0,8,8,"on, just to think and reflect about life.",,,,The rustling leaves always remind me of the,,,,30000,30000
