timestamp,sender,text
597,LLMAssistant,"Hello, this is a present message that you can edit in your code in ParticipantInitiated.js (initialMessages)."
597,LLMAssistant,"This is the second message, you can edit, add more, or delete me."
25507,user,okay can u help me write about the weather
25507,LLMAssistant,"Of course! Here's a sample paragraph about the weather:

---

The weather is an ever-changing facet of our environment, influencing our daily lives in countless ways. As the seasons transition, the temperature, precipitation, and winds evolve, creating a dynamic atmosphere around us. In the spring, blossoms emerge after months of dormancy, as gentle rains nourish the ground. Summer brings warmth and longer days, inviting people to enjoy outdoor activities and bask in the sunshine. Autumn is characterized by crisp air and the vibrant hues of falling leaves, creating a picturesque landscape. Winter often blankets the earth in snow, offering a serene and tranquil beauty, although it can bring challenges in the form of icy roads and frigid temperatures. Weather patterns can also vary greatly by region, with some areas experiencing tropical storms, others welcoming mild and temperate conditions, and some enduring arid desert climates. Understanding the weather not only helps us prepare for our day-to-day activities but also underscores the interconnectedness of Earth's natural systems.

---

Feel free to tweak or expand on this, depending on your specific focus or the type of writing you're aiming for!"
141418,user,thank you!
141418,LLMAssistant,"You're welcome! If you need any more help or have any other questions, feel free to ask. Happy writing!"
