timestamp,sender,text
360,LLMAssistant,"Hello, this is a present message that you can edit in your code in ToggleableLLM.js (initialMessages)."
360,LLMAssistant,"This is the second message, you can edit, add more, or delete me."
55433,user,"oh hi, I want to write about my love for nature, can u make 2 suggestions so i can write"
55433,LLMAssistant,"Of course! Here are two suggestions to help you express your love for nature:

1. **Focus on Personal Experiences:**
   - Begin with a vivid description of a memorable experience you had in nature. This could be a hike through a lush forest, a peaceful day by the ocean, or a camping trip under a starry sky.
   - Describe the sights, sounds, and feelings that made this moment special for you. Reflect on how being in nature made you feel and how it has influenced your life and well-being.

2. **Explore Nature’s Healing Power:**
   - Discuss the therapeutic aspects of nature and how spending time outdoors has helped you relax, recharge, and find clarity.
   - Share specific examples of how nature has served as a refuge during stressful times or how it has inspired creativity, gratitude, and a sense of connection to the world around you.

These suggestions can serve as starting points to deeply convey your appreciation for the natural world."
154673,user,"thank you, what would u add"
154673,LLMAssistant,"You're welcome! Here are a few additional ideas you might add to deepen your piece:

1. **Connection to Seasons:**
   - Talk about how different seasons bring unique beauty and experiences. Maybe you love the vibrant colors of autumn leaves, the renewal of spring blooms, the serenity of a winter landscape, or the energy of a summer day.

2. **Nature's Lessons:**
   - Reflect on the life lessons you've learned from observing nature. This could include the patience of growing plants, the resilience of wildlife, or the cycles of change and renewal in ecosystems.

3. **Environmental Stewardship:**
   - Express any actions you take to protect and preserve nature. This could range from simple habits like recycling or participating in community clean-ups, to advocating for environmental policies or educating others about the importance of conservation.

4. **Cultural or Historical Significance:**
   - If applicable, delve into how different natural places hold cultural or historical value for you or your community. This might involve storytelling, traditions, or any personal meaning tied to these places.

5. **Interconnection with Technology:**
   - Consider discussing how you balance technology with nature. For instance, using tech to enhance your experience outdoors through photography, nature apps for learning, or simply knowing when to disconnect to fully immerse yourself in your surroundings.

These elements can enrich your narrative and help readers connect with your love for nature on a deeper level."
168590,user,can u add a sentence to my writing
168590,LLMAssistant,"Certainly! Here's your original piece with an added sentence:

Hey, I want to write today about my love for nature. I remember myself as a kid running between the trees, a peaceful day in the forest with the family. We never camped; I thought I was afraid of bugs, but it turns out, I was actually afraid of sleeping in a tent, really. It's weird, nature is really healing, and I love spending time there with music on, just to think and reflect about life. The rustling leaves and the gentle breeze always remind me of the simplicity and beauty that life has to offer, bringing a sense of calm and perspective that I carry with me long after I leave. 

Feel free to adjust or expand on this to better fit your voice and style!"
